{"schema_version":4,"spec_id":"m15-search-work-calibration-v2","budget_mode":"calibrated_grid","calibrated_parameter":"per_world_work","world_sampling_count":16,"total_work_formula":"world_sampling_count_times_per_world_work","reference_environment_specification":{"python":"3.14","platform":"ubuntu-24.04","runtime_profile":"offline_m15_calibration"},"calibration_state_rule_id":"m15-synthetic-calibration-state-v2","calibration_state_manifest_digest":"sha256:325307d34b87f76080c160d9b31eb6283e9a812fdf149b9c7fc6ac5c8b1780c9","ordered_work_grid":[64,128,256,512],"selection_rule_id":"largest-value-under-runtime-limit-v1","measurement_profile_id":"m15-runtime-only-v1","selection_measurement_id":"wall_time_ms","required_measurement_ids":["wall_time_ms","cpu_time_ms"],"runtime_limits_ms":{"wall_time_ms":2000,"cpu_time_ms":2000},"allowed_runtime_measurements":["wall_time_ms","cpu_time_ms","peak_memory_bytes"],"forbidden_quality_measurements":["decision_regret_teacher_v1","battle_outcome_weighted_v1","teacher_top1_agreement_v1","selection_holdout_score","release_holdout_score"]}
